Name, URL
One Step Hand Sanitizer with Aloe,/en/ip/one-step-hand-sanitizer-with-aloe/6000078571138
Purell Instant Hand Sanitizer with Aloe,/en/ip/purell-instant-hand-sanitizer-with-aloe/6000040041123
"NIVEA Soft All-Purpose Moisturizing Cream (75 mL), Everyday Moisturizer and Hand Cream for Use After Hand Sanitizer or Hand Soap Light and Non-Greasy Formula",/en/ip/nivea-soft-all-purpose-moisturizing-cream-75-ml-everyday-moisturizer-and-hand-cream-for-use-after-hand-sanitizer-or-hand-soap-light-and-non-greasy-for/6000016942040
"NIVEA 3-in-1 Q10 Anti-Age Hand Cream (100mL), Hand Cream for Normal to Dry Hands, Moisture Care Formula for Smooth Hands, For Use After Hand Sanitizer or Hand Soap",/en/ip/nivea-3-in-1-q10-anti-age-hand-cream-100ml-hand-cream-for-normal-to-dry-hands-moisture-care-formula-for-smooth-hands-for-use-after-hand-sanitizer-or-h/6000200613263
"NIVEA Smooth Care Hand Cream with Shea Butter Duo Pack (2x100mL), Hand Cream for All Skin Types, Caring and Moisturizing Cream for Use After Hand Sanitizer or Hand Soap",/en/ip/nivea-smooth-care-hand-cream-with-shea-butter-duo-pack-2x100ml-hand-cream-for-all-skin-types-caring-and-moisturizing-cream-for-use-after-hand-sanitize/6000197347182
Equate Liquid Hand Soap,/en/ip/equate-liquid-hand-soap/6000187783290
One Step Extra Strength Hand Sanitizer,/en/ip/one-step-extra-strength-hand-sanitizer/6000079337880
One Step 1 L Hand Sanitizer,/en/ip/one-step-1-l-hand-sanitizer/6000079183836
Equate Instant Hand Sanitizer,/en/ip/equate-instant-hand-sanitizer/6000187108967
One Step Hand Sanitizer Wipes,/en/ip/one-step-hand-sanitizer-wipes/6000001827700
Equate Instant Hand Sanitizer,/en/ip/equate-instant-hand-sanitizer/6000187108970
Purell Instant Hand Sanitizer with Aloe,/en/ip/purell-instant-hand-sanitizer-with-aloe/6000101672641
Equate Instant Hand Sanitizer,/en/ip/equate-instant-hand-sanitizer/6000187108964
Equate Instant Hand Sanitizer,/en/ip/equate-instant-hand-sanitizer/6000196009276
One Step 473 mL Fragrance Free Hand Sanitizer,/en/ip/one-step-473-ml-fragrance-free-hand-sanitizer/6000079337617
Purell Advanced Green Hand Sanitizer,/en/ip/purell-advanced-green-hand-sanitizer/6000196744052
Purell Instant Hand Sanitizer with Aloe,/en/ip/purell-instant-hand-sanitizer-with-aloe/6000117078778
Purell Instant Hand Sanitizer,/en/ip/purell-instant-hand-sanitizer/6000117078845
J.R Watkins Lemon Cream Liquid Hand Soap,/en/ip/jr-watkins-lemon-cream-liquid-hand-soap/6000199314401
"X3 Clean Germ Attack Hand Sanitizer - Alcohol Free, Fragrance Free",/en/ip/x3-clean-germ-attack-hand-sanitizer-alcohol-free-fragrance-free/6000077806981
Purell Advanced Jelly Wrap Refreshing Gel Hand Sanitizer Value Pack,/en/ip/purell-advanced-jelly-wrap-refreshing-gel-hand-sanitizer-value-pack/6000117079045
Love Beauty and Planet Yuzu & Vanilla Hand Wash,/en/ip/love-beauty-and-planet-yuzu-vanilla-hand-wash/6000200703396
Delon+ Hand Sanitizer Gel,/en/ip/delon-hand-sanitizer-gel/6000201402900
Dove Foaming Hand Wash To Cleanse and Nourish Hands Pink Lotus & Rice Water 100% Gentle Cleanser Formula 200 ML,/en/ip/dove-foaming-hand-wash-to-cleanse-and-nourish-hands-pink-lotus-rice-water-100-gentle-cleanser-formula-200-ml/6000199120614
"NIVEA 3-in-1 Repair & Care Hand Cream (100mL), Hand Cream for Very Dry Hands, Moisturizing Cream with Pro-Vitamin B5 for Use After Hand Sanitizer or Hand Soap",/en/ip/nivea-3-in-1-repair-care-hand-cream-100ml-hand-cream-for-very-dry-hands-moisturizing-cream-with-pro-vitamin-b5-for-use-after-hand-sanitizer-or-hand-so/6000200613042
Dove Foaming Hand Wash Refill To Cleanse and Nourish Hands Sugar Cane & Warm Vanilla 100% Gentle Cleanser Formula 946 ML,/en/ip/dove-foaming-hand-wash-refill-to-cleanse-and-nourish-hands-sugar-cane-warm-vanilla-100-gentle-cleanser-formula-946-ml/6000199122264
Pears Hand Wash Lemon Extract,/en/ip/pears-hand-wash-lemon-extract/6000198226532
